{"artifact_fingerprint":"7b5ebe136c561a9839b5509bb3f6121631960639f1f18c1d9115993cbc6420fb","artifacts":[{"path":"github-actions://umtong/SMC_ICT_2_LIVE/actions/runs/30148379159/artifacts/8616872985","sha256":"7b5ebe136c561a9839b5509bb3f6121631960639f1f18c1d9115993cbc6420fb"},{"path":"drive://19quRc7Gr0Zu_kf-j_E62na2lI-roNfIx","sha256":"7b5ebe136c561a9839b5509bb3f6121631960639f1f18c1d9115993cbc6420fb"},{"path":"artifact://OUTPUT_SHA256SUMS.txt","sha256":"28a5b494785c0d4fad2388e44ee88d8da21663f5ba7e7a43dd009105f12b1f3c"}],"claim_id":"CLM-GPT56-20260725-001","code_commit":"7ef6f944eadbc0b687338388ca5015bdae57322d","created_at":"2026-07-25T16:14:56+09:00","dataset_ids":["DS-BINANCE-USDM-BTCETH-1M-202110-202212-AW1"],"dependency_fingerprint":"73ca040e59b188e2d88087e68482d8a91bce4eff70abc0472ea0fce3ba72ae3f","evaluation_contract_sha256":"f976d126f5ea9f96dac0a78aebd8d22fab57e52b4bf3e5803a516ee60f99f96d","result_id":"RES-20260725-CAUSAL-ALPHA-WAVE1-001","schema_version":1,"source_ids":["youtube:gcrJXbmNWFY:transcript:ko","youtube:dHZNSbF32eA:transcript:ko","youtube:xlYuENlNZN0:transcript:ko","youtube:V3kCjvJy3bg:transcript:ko","SRC-BINANCE-PUBLIC-DATA-USD-M-20260725"],"status":"INVALID","summary":"Official Binance BTCUSDT/ETHUSDT 1m klines and actual funding, 2021-10 warm-up plus 2022 development, 272 causal one-global-slot candidates across liquidity sweep reclaim/acceptance, balance-to-imbalance, displacement-origin retest, cross-asset lag and Donchian baseline. Zero candidates passed the preregistered development gate, so frozen 2023 validation remained unopened. Every nonzero-trade family had negative base and stress growth, negative median trade and negative growth after removing the largest 10 winners. Best nonzero result was balance-to-imbalance: 107 trades, base account multiple 0.7692, geometric daily -0.0719%, mean -24.52bp, median -26.35bp, PF 0.316, MDD 23.08%, after-top10 log growth -0.3601. No Champion eligibility." ,"worker_id":"gpt-5.6-pro"}
